{"chain_days":[{"absent":{"neighbours":[{"chain_root":"27f678c7c3c9f763cb99aa6bfb4715d4667faa4b0d6c9f8a2e36e20250b4233c","leaf_index":2,"path":["4b6498305386a41d96cec9a9d064f63af532538f0c48907caa58f4618ff321ec","eab306e720e2cc96b755b9fc1a8e31f34e448adf0fa615f81ef4f54cfa05b4b0","3bc3f3d4752763919917958440a1997224c1218d5ef038d09a9ca99d1eb88806"],"position":"6a67ff9572b4d663920a2e740361b09ee2cb6acae8ecf613e6a30b16aad350f9"},{"chain_root":"b48375ab1d0a8b4e54d42d8a7c6239eea5ebac215b1b07f45cf8f912030bb2ea","leaf_index":3,"path":["294970b630c3526afb9c691702e0e939842253339bb6831386b70502f012f8c5","eab306e720e2cc96b755b9fc1a8e31f34e448adf0fa615f81ef4f54cfa05b4b0","3bc3f3d4752763919917958440a1997224c1218d5ef038d09a9ca99d1eb88806"],"position":"b1ed9cae78dcfafe822b101de7ce470c80f85b3838f7d2701da3de2b588e2c04"}]},"day":"2026-01-01","present":null}],"chain_id":"d4767e29-b2ab-48f5-9186-37d10dad22c0","days":[{"additional_signatures":[],"entry":{"server_key_id":"vendor-log-test-001","server_signature":"8066281f0a4396ff5fb73007a673651d847ba09d62d9ca2a45b701a2b028c14948d5a4778c1c6671009a885c591751a3ee72099d83c19d21e72891b4af457f0e","statement_jcs":"{\"day\":\"2026-01-01\",\"first_day\":\"2025-12-31\",\"kind\":\"ledger.vendor_log_day.v1\",\"log_id\":\"ledger-testprotokoll-1\",\"prev_hash\":\"33fd1b2966e2f17af53d478066c97f1da0a181ed1107aaa34341eb4bc3067055\",\"root\":\"0adcf8f084c1c9c0e8998f01a0a9a9b57e96b5e9135e2833cbb10c6a9e121871\",\"server_ts\":\"2026-01-02T00:05:00.000Z\",\"tree_size\":5}"},"timestamps":["MIIDXgYJKoZIhvcNAQcCoIIDTzCCA0sCAQMxDTALBglghkgBZQMEAgMwagYLKoZIhvcNAQkQAQSgWwRZMFcCAQEGDCsGAQQBho0fA4EhAjAvMAsGCWCGSAFlAwQCAQQg7zMNIEnpOx2g6TSnoOAeax3CbTkv/awID/DsAIieLBwCAiACGA8yMDI2MDEwMjAwMDUwMVqgggFvMIIBazCCAR2gAwIBAgIBAjAFBgMrZXAwSTETMBEGA1UECgwKVGVzdGtvcnB1czEyMDAGA1UEAwwpVGVzdGtvcnB1cyBaZWl0c3RlbXBlbHd1cnplbCAoa2VpbiBaZXVnZSkwHhcNMjUwNjAxMDAwMDAwWhcNMzEwMTAxMDAwMDAwWjBJMRMwEQYDVQQKDApUZXN0a29ycHVzMTIwMAYDVQQDDClUZXN0a29ycHVzIFplaXRzdGVtcGVsc3RlbGxlIChrZWluIFpldWdlKTAqMAUGAytlcAMhAAVGjvI5slNciWer7MP4+J7KJ0O0SxOR46Sd2BBXDfQAoyowKDAOBgNVHQ8BAf8EBAMCB4AwFgYDVR0lAQH/BAwwCgYIKwYBBQUHAwgwBQYDK2VwA0EActwtEkWL7QJ+ML6pNTHxakVjOdps+Nnyqtv9Gt/Q6tqr0MB31axDIMyk6sSsbOpsSrZvbQjyQJdgmv4EYfzpDzGCAVYwggFSAgEBME4wSTETMBEGA1UECgwKVGVzdGtvcnB1czEyMDAGA1UEAwwpVGVzdGtvcnB1cyBaZWl0c3RlbXBlbHd1cnplbCAoa2VpbiBaZXVnZSkCAQIwCwYJYIZIAWUDBAIDoIGmMBoGCSqGSIb3DQEJAzENBgsqhkiG9w0BCRABBDA3BgsqhkiG9w0BCRACLzEoMCYwJDAiBCD3lGg52JlY9bTnaU4oaTPBwZ2Cchin5XQBvg9HoL2jzDBPBgkqhkiG9w0BCQQxQgRAesnTpf+ftxJknUFgY50yEv3ehLvyBya1HkcrzUdo8Fvn1k13Wh6z8WhPRHXx0Ez8IbgDy13fMn3U8pjUnt2cPzAFBgMrZXAEQHLK8vcUjHwaxIAqfXcLBEfr75chvc3BMFM5Vf4EylycUV0zZDMBs6Oxlj6/3XT9Em1aVLGpq6qqXy/8My898A4="]}],"format":"ledger-protokollauszug/1","log_id":"ledger-testprotokoll-1","protocol_keys":{"ausgestellt":"2025-12-30T10:00:00.000Z","erster_tag":"2025-12-31","format":"ledger-protokollschluessel/1","fuellerbindung":"82ba087e5b1b7bee5dbfb6b34620efb2e23e1426ad25fe60a672035fb3a99efe","log_id":"ledger-testprotokoll-1","orte":["https://download.example/ledger-testprotokoll-1","https://mirror.example/ledger-testprotokoll-1"],"schluessel":[{"gueltig_ab":"2025-12-30T00:00:00.000Z","key_id":"vendor-log-test-001","pubkey":"cee49a5a497e248e6be0af06ace16850e8f0eb4c306a212f5430359e8076fdd7"},{"gueltig_ab":"2025-12-30T00:00:00.000Z","key_id":"vendor-log-test-002","pubkey":"8319d7221fdbb1680cb36c8fe33d1507992f14db30ed57c71c46f4ef9313d2a2"}],"signatur":{"sig":"6d0e1d46952e6cf60c640feab00181051fd353a65086dfdff7e7c660feb22650481052690ca0b1f129caed3b4385999d170776d8a89dc94ef859955190aea90a","wurzel_id":"testwurzel-1"},"version":1}}
