{"chain_days":[{"absent":null,"day":"2026-01-02","present":{"leaf_index":1,"path":["dc78d736670aacefaaf072fd6f9255bea6b72ec977a3169ea07dd75a85c4ac19","aba7e6079b2916f5f57d4a24d5549e8cbc804f2be8db66af7b0c1f4f8733c263","878e8cbe4a32db25bfe05d6d900881150a0338813d917ecc0c7fb8354c90dc9e"],"roots":[{"merkle_root":"f94de1ae3d3cdf58110eb276a44f73568118d9c8ee8f2354cc6abd2097b2aefc","recorded_as":"countersigned","server_ts":"2026-01-02T23:55:01.000Z","tree_size":5}]}},{"absent":null,"day":"2026-01-02","present":{"leaf_index":1,"path":["dc78d736670aacefaaf072fd6f9255bea6b72ec977a3169ea07dd75a85c4ac19","aba7e6079b2916f5f57d4a24d5549e8cbc804f2be8db66af7b0c1f4f8733c263","878e8cbe4a32db25bfe05d6d900881150a0338813d917ecc0c7fb8354c90dc9e"],"roots":[{"merkle_root":"f94de1ae3d3cdf58110eb276a44f73568118d9c8ee8f2354cc6abd2097b2aefc","recorded_as":"countersigned","server_ts":"2026-01-02T23:55:01.000Z","tree_size":5}]}}],"chain_id":"ce31e4e6-2228-4dd1-9ce3-6ffcb611013f","days":[{"additional_signatures":[],"entry":{"server_key_id":"vendor-log-test-001","server_signature":"70951e984ffc7e3635164eed03fa16be26c078a5ede33e22f2c6bb276e7066f57b155a020002c89477726968a315bc1d19ab4f420a2a07402163d88efccdc80e","statement_jcs":"{\"day\":\"2026-01-02\",\"first_day\":\"2025-12-31\",\"kind\":\"ledger.vendor_log_day.v1\",\"log_id\":\"ledger-testprotokoll-1\",\"prev_hash\":\"ef330d2049e93b1da0e934a7a0e01e6b1dc26d392ffdac080ff0ec00889e2c1c\",\"root\":\"7ab3a2bbe29220b513b8b6d43e10216c1c5c7103f04f3ca445e0aa3c81c2ea00\",\"server_ts\":\"2026-01-03T00:05:00.000Z\",\"tree_size\":5}"},"timestamps":["MIIDXgYJKoZIhvcNAQcCoIIDTzCCA0sCAQMxDTALBglghkgBZQMEAgMwagYLKoZIhvcNAQkQAQSgWwRZMFcCAQEGDCsGAQQBho0fA4EhAjAvMAsGCWCGSAFlAwQCAQQgHAgfUVqdBSg3TmNaGtb57GX8MQL2cdFsnd1jgmRLbcICAiADGA8yMDI2MDEwMzAwMDUwMVqgggFvMIIBazCCAR2gAwIBAgIBAjAFBgMrZXAwSTETMBEGA1UECgwKVGVzdGtvcnB1czEyMDAGA1UEAwwpVGVzdGtvcnB1cyBaZWl0c3RlbXBlbHd1cnplbCAoa2VpbiBaZXVnZSkwHhcNMjUwNjAxMDAwMDAwWhcNMzEwMTAxMDAwMDAwWjBJMRMwEQYDVQQKDApUZXN0a29ycHVzMTIwMAYDVQQDDClUZXN0a29ycHVzIFplaXRzdGVtcGVsc3RlbGxlIChrZWluIFpldWdlKTAqMAUGAytlcAMhAAVGjvI5slNciWer7MP4+J7KJ0O0SxOR46Sd2BBXDfQAoyowKDAOBgNVHQ8BAf8EBAMCB4AwFgYDVR0lAQH/BAwwCgYIKwYBBQUHAwgwBQYDK2VwA0EActwtEkWL7QJ+ML6pNTHxakVjOdps+Nnyqtv9Gt/Q6tqr0MB31axDIMyk6sSsbOpsSrZvbQjyQJdgmv4EYfzpDzGCAVYwggFSAgEBME4wSTETMBEGA1UECgwKVGVzdGtvcnB1czEyMDAGA1UEAwwpVGVzdGtvcnB1cyBaZWl0c3RlbXBlbHd1cnplbCAoa2VpbiBaZXVnZSkCAQIwCwYJYIZIAWUDBAIDoIGmMBoGCSqGSIb3DQEJAzENBgsqhkiG9w0BCRABBDA3BgsqhkiG9w0BCRACLzEoMCYwJDAiBCD3lGg52JlY9bTnaU4oaTPBwZ2Cchin5XQBvg9HoL2jzDBPBgkqhkiG9w0BCQQxQgRAMBZXudqoitMVwZeY1RveM13mLD568K4d0zc2SBnVTNz/Wco6x+q11TWmMmp95zFjB3XSXtLNn0gC+0IAtUd+gDAFBgMrZXAEQMkiPaMBdM3OMYWfWKX1CPnjVeYuacoMep8cJU5mg6qKceuK0Dv9Le2V6S2KzZ8DGBMo4DTXQiNTh3E7xr/yTQ4="]}],"format":"ledger-protokollauszug/1","log_id":"ledger-testprotokoll-1","protocol_keys":{"ausgestellt":"2025-12-30T10:00:00.000Z","erster_tag":"2025-12-31","format":"ledger-protokollschluessel/1","fuellerbindung":"82ba087e5b1b7bee5dbfb6b34620efb2e23e1426ad25fe60a672035fb3a99efe","log_id":"ledger-testprotokoll-1","orte":["https://download.example/ledger-testprotokoll-1","https://mirror.example/ledger-testprotokoll-1"],"schluessel":[{"gueltig_ab":"2025-12-30T00:00:00.000Z","key_id":"vendor-log-test-001","pubkey":"cee49a5a497e248e6be0af06ace16850e8f0eb4c306a212f5430359e8076fdd7"},{"gueltig_ab":"2025-12-30T00:00:00.000Z","key_id":"vendor-log-test-002","pubkey":"8319d7221fdbb1680cb36c8fe33d1507992f14db30ed57c71c46f4ef9313d2a2"}],"signatur":{"sig":"6d0e1d46952e6cf60c640feab00181051fd353a65086dfdff7e7c660feb22650481052690ca0b1f129caed3b4385999d170776d8a89dc94ef859955190aea90a","wurzel_id":"testwurzel-1"},"version":1}}
