{"chain_days":[{"absent":null,"day":"2026-01-02","present":{"leaf_index":3,"path":["2e394a46ea46cc80b472cc0b82929679b4f73f56d70fead1501a5a6c5c273e56","1af55ee78ffd6b957bfab5dd07050fe526fcc351b4a046db001c566b272f9e82","878e8cbe4a32db25bfe05d6d900881150a0338813d917ecc0c7fb8354c90dc9e"],"roots":[{"merkle_root":"879167937d5351ed568ad570b08b830aaf0934f57695def4f66ce217ceeab41f","recorded_as":"countersigned","server_ts":"2026-01-02T23:55:01.000Z","tree_size":5}]}}],"chain_id":"a4a6ef98-c460-499b-b67a-ecc345c135a1","days":[{"additional_signatures":[],"entry":{"server_key_id":"vendor-log-test-001","server_signature":"8d76effd6293ebee3fdf7f7d4b4377af219f89104fab2e9c88974e71308ad8618e4ef0253f6c092d1e33377d074d5b830765eb5a72856aa4e5c9aa1f9929d20d","statement_jcs":"{\"day\":\"2026-01-02\",\"first_day\":\"2025-12-31\",\"kind\":\"ledger.vendor_log_day.v1\",\"log_id\":\"ledger-testprotokoll-1\",\"prev_hash\":\"ef330d2049e93b1da0e934a7a0e01e6b1dc26d392ffdac080ff0ec00889e2c1c\",\"root\":\"c09a26a7f4ee575611b37ea13ff7f449d9f1fa842c2b30dc36dc727294a96659\",\"server_ts\":\"2026-01-03T00:05:00.000Z\",\"tree_size\":5}"},"timestamps":["MIIDJAYJKoZIhvcNAQcCoIIDFTCCAxECAQMxDTALBglghkgBZQMEAgMwagYLKoZIhvcNAQkQAQSgWwRZMFcCAQEGDCsGAQQBho0fA4EhAjAvMAsGCWCGSAFlAwQCAQQgJMycdKVoCEB/CLB5q/mx+X6gU2zy7XwpE6xrTtVoCQACAiADGA8yMDI2MDEwMzAwMDUwMVqgggFvMIIBazCCAR2gAwIBAgIBAjAFBgMrZXAwSTETMBEGA1UECgwKVGVzdGtvcnB1czEyMDAGA1UEAwwpVGVzdGtvcnB1cyBaZWl0c3RlbXBlbHd1cnplbCAoa2VpbiBaZXVnZSkwHhcNMjUwNjAxMDAwMDAwWhcNMzEwMTAxMDAwMDAwWjBJMRMwEQYDVQQKDApUZXN0a29ycHVzMTIwMAYDVQQDDClUZXN0a29ycHVzIFplaXRzdGVtcGVsc3RlbGxlIChrZWluIFpldWdlKTAqMAUGAytlcAMhAAVGjvI5slNciWer7MP4+J7KJ0O0SxOR46Sd2BBXDfQAoyowKDAOBgNVHQ8BAf8EBAMCB4AwFgYDVR0lAQH/BAwwCgYIKwYBBQUHAwgwBQYDK2VwA0EActwtEkWL7QJ+ML6pNTHxakVjOdps+Nnyqtv9Gt/Q6tqr0MB31axDIMyk6sSsbOpsSrZvbQjyQJdgmv4EYfzpDzGCARwwggEYAgEBME4wSTETMBEGA1UECgwKVGVzdGtvcnB1czEyMDAGA1UEAwwpVGVzdGtvcnB1cyBaZWl0c3RlbXBlbHd1cnplbCAoa2VpbiBaZXVnZSkCAQIwCwYJYIZIAWUDBAIDoG0wGgYJKoZIhvcNAQkDMQ0GCyqGSIb3DQEJEAEEME8GCSqGSIb3DQEJBDFCBEDlbWPxVQ2zKLlNKIbbMpKjlPXttSMWaBNLO6y+US3p3U72R8iA9TTt2d1LGSoPRMBd67qu5asb0XHKgXCBkAvRMAUGAytlcARANxv/+tDKopLEMePS8PzmLM0wuGUk/3b5CLI6TyHv3gJcb5sly3EsbR4KjaBrTcmGpzodJmOwitbfOPqk6sfzBg=="]}],"format":"ledger-protokollauszug/1","log_id":"ledger-testprotokoll-1","protocol_keys":{"ausgestellt":"2025-12-30T10:00:00.000Z","erster_tag":"2025-12-31","format":"ledger-protokollschluessel/1","fuellerbindung":"82ba087e5b1b7bee5dbfb6b34620efb2e23e1426ad25fe60a672035fb3a99efe","log_id":"ledger-testprotokoll-1","orte":["https://download.example/ledger-testprotokoll-1","https://mirror.example/ledger-testprotokoll-1"],"schluessel":[{"gueltig_ab":"2025-12-30T00:00:00.000Z","key_id":"vendor-log-test-001","pubkey":"cee49a5a497e248e6be0af06ace16850e8f0eb4c306a212f5430359e8076fdd7"},{"gueltig_ab":"2025-12-30T00:00:00.000Z","key_id":"vendor-log-test-002","pubkey":"8319d7221fdbb1680cb36c8fe33d1507992f14db30ed57c71c46f4ef9313d2a2"}],"signatur":{"sig":"6d0e1d46952e6cf60c640feab00181051fd353a65086dfdff7e7c660feb22650481052690ca0b1f129caed3b4385999d170776d8a89dc94ef859955190aea90a","wurzel_id":"testwurzel-1"},"version":1}}
