{"chain_days":[{"absent":null,"day":"2026-01-02","present":{"leaf_index":3,"path":["2e394a46ea46cc80b472cc0b82929679b4f73f56d70fead1501a5a6c5c273e56","1af55ee78ffd6b957bfab5dd07050fe526fcc351b4a046db001c566b272f9e82","878e8cbe4a32db25bfe05d6d900881150a0338813d917ecc0c7fb8354c90dc9e"],"roots":[{"merkle_root":"e62f15483d83c4d69a5b7466ac736f0c7c8c8b82e9a330dbce7ce093e206628f","recorded_as":"countersigned","server_ts":"2026-01-02T23:55:01.000Z","tree_size":5}]}}],"chain_id":"9c0379a4-f4ab-4ebf-abfa-bfe75c8d73e3","days":[{"additional_signatures":[],"entry":{"server_key_id":"vendor-log-test-001","server_signature":"f0ab4c47caee21fed9ccd3209acbd431ab0140bb73b5cd4a3b8ffe75f739c07727276242602d2c2b9c457e8d644f419ebffd3bd0b902b49014f52fa4de585a07","statement_jcs":"{\"day\":\"2026-01-02\",\"first_day\":\"2025-12-31\",\"kind\":\"ledger.vendor_log_day.v1\",\"log_id\":\"ledger-testprotokoll-1\",\"prev_hash\":\"ef330d2049e93b1da0e934a7a0e01e6b1dc26d392ffdac080ff0ec00889e2c1c\",\"root\":\"bea286a74ca52d728f83706da919aac23c13a888ca9c5ed747a6e3a59f85ac2f\",\"server_ts\":\"2026-01-03T00:05:00.000Z\",\"tree_size\":5}"},"timestamps":["MIIB6wYJKoZIhvcNAQcCoIIB3DCCAdgCAQMxDTALBglghkgBZQMEAgMwagYLKoZIhvcNAQkQAQSgWwRZMFcCAQEGDCsGAQQBho0fA4EhAjAvMAsGCWCGSAFlAwQCAQQgKNHjObHEOGr9r/ihGYwx/OyRuOWT2w4S+dnRkpl7q5YCAiADGA8yMDI2MDEwMzAwMDUwMVoxggFWMIIBUgIBATBOMEkxEzARBgNVBAoMClRlc3Rrb3JwdXMxMjAwBgNVBAMMKVRlc3Rrb3JwdXMgWmVpdHN0ZW1wZWx3dXJ6ZWwgKGtlaW4gWmV1Z2UpAgECMAsGCWCGSAFlAwQCA6CBpjAaBgkqhkiG9w0BCQMxDQYLKoZIhvcNAQkQAQQwNwYLKoZIhvcNAQkQAi8xKDAmMCQwIgQg95RoOdiZWPW052lOKGkzwcGdgnIYp+V0Ab4PR6C9o8wwTwYJKoZIhvcNAQkEMUIEQPUec3jxJakJy3WgKQyPm7CljqW5YzO5XF4zWsQEXx11xp63AZDuOGFUhB76gTuK4BpTnkmhy79JS/qahhf0F38wBQYDK2VwBEAuI77slYZQVsicWVAORx4dSI91PmoxDzZHyJvxH5JwcDxdiJUP/qOPlelHXJbJfi3s4aUH6cm+CnhZetcnYAwA"]}],"format":"ledger-protokollauszug/1","log_id":"ledger-testprotokoll-1","protocol_keys":{"ausgestellt":"2025-12-30T10:00:00.000Z","erster_tag":"2025-12-31","format":"ledger-protokollschluessel/1","fuellerbindung":"82ba087e5b1b7bee5dbfb6b34620efb2e23e1426ad25fe60a672035fb3a99efe","log_id":"ledger-testprotokoll-1","orte":["https://download.example/ledger-testprotokoll-1","https://mirror.example/ledger-testprotokoll-1"],"schluessel":[{"gueltig_ab":"2025-12-30T00:00:00.000Z","key_id":"vendor-log-test-001","pubkey":"cee49a5a497e248e6be0af06ace16850e8f0eb4c306a212f5430359e8076fdd7"},{"gueltig_ab":"2025-12-30T00:00:00.000Z","key_id":"vendor-log-test-002","pubkey":"8319d7221fdbb1680cb36c8fe33d1507992f14db30ed57c71c46f4ef9313d2a2"}],"signatur":{"sig":"6d0e1d46952e6cf60c640feab00181051fd353a65086dfdff7e7c660feb22650481052690ca0b1f129caed3b4385999d170776d8a89dc94ef859955190aea90a","wurzel_id":"testwurzel-1"},"version":1}}
