{"chain_days":[{"absent":null,"day":"2026-01-02","present":{"leaf_index":1,"path":["dc78d736670aacefaaf072fd6f9255bea6b72ec977a3169ea07dd75a85c4ac19","aba7e6079b2916f5f57d4a24d5549e8cbc804f2be8db66af7b0c1f4f8733c263","878e8cbe4a32db25bfe05d6d900881150a0338813d917ecc0c7fb8354c90dc9e"],"roots":[{"merkle_root":"1a6d9cb4febaa050a3233e004c9bd22caa92b4c295ced29da2f43de06d7d5320","recorded_as":"countersigned","server_ts":"2026-01-02T23:55:01.000Z","tree_size":5}]}}],"chain_id":"a6abb1ba-630c-47a4-aeeb-bd346cdd2445","days":[{"additional_signatures":[],"entry":{"server_key_id":"vendor-log-test-001","server_signature":"f4baab99a066352d93c9d8916f3f85a6581ab050adac095c92fa0462df031b699f9bff1d99d6a614b3040de34e7feb2614c303e0d5175574789e43901ab7490f","statement_jcs":"{\"day\":\"2026-01-02\",\"first_day\":\"2025-12-31\",\"kind\":\"ledger.vendor_log_day.v1\",\"log_id\":\"ledger-testprotokoll-1\",\"prev_hash\":\"ef330d2049e93b1da0e934a7a0e01e6b1dc26d392ffdac080ff0ec00889e2c1c\",\"root\":\"6111378708fe0c0b04127c5acb8316a1cf22e45dfd2bd6c82bc4605451ece7e9\",\"server_ts\":\"2026-01-03T00:05:00.000Z\",\"tree_size\":5}"},"timestamps":["MIIDXgYJKoZIhvcNAQcCoIIDTzCCA0sCAQMxDTALBglghkgBZQMEAgMwagYLKoZIhvcNAQkQAQSgWwRZMFcCAQEGDCsGAQQBho0fA4EhAjAvMAsGCWCGSAFlAwQCAQQgB+ncwqX/7msDjl03+E4WuVUrPKIjsIePNQRd8hNn23ICAiADGA8yMDI2MDEwMzAwMDUwMVqgggFvMIIBazCCAR2gAwIBAgIBAjAFBgMrZXAwSTETMBEGA1UECgwKVGVzdGtvcnB1czEyMDAGA1UEAwwpVGVzdGtvcnB1cyBaZWl0c3RlbXBlbHd1cnplbCAoa2VpbiBaZXVnZSkwHhcNMjUwNjAxMDAwMDAwWhcNMzEwMTAxMDAwMDAwWjBJMRMwEQYDVQQKDApUZXN0a29ycHVzMTIwMAYDVQQDDClUZXN0a29ycHVzIFplaXRzdGVtcGVsc3RlbGxlIChrZWluIFpldWdlKTAqMAUGAytlcAMhAAVGjvI5slNciWer7MP4+J7KJ0O0SxOR46Sd2BBXDfQAoyowKDAOBgNVHQ8BAf8EBAMCB4AwFgYDVR0lAQH/BAwwCgYIKwYBBQUHAwgwBQYDK2VwA0EActwtEkWL7QJ+ML6pNTHxakVjOdps+Nnyqtv9Gt/Q6tqr0MB31axDIMyk6sSsbOpsSrZvbQjyQJdgmv4EYfzpDzGCAVYwggFSAgEBME4wSTETMBEGA1UECgwKVGVzdGtvcnB1czEyMDAGA1UEAwwpVGVzdGtvcnB1cyBaZWl0c3RlbXBlbHd1cnplbCAoa2VpbiBaZXVnZSkCAQIwCwYJYIZIAWUDBAIDoIGmMBoGCSqGSIb3DQEJAzENBgsqhkiG9w0BCRABBDA3BgsqhkiG9w0BCRACLzEoMCYwJDAiBCD3lGg52JlY9bTnaU4oaTPBwZ2Cchin5XQBvg9HoL2jzDBPBgkqhkiG9w0BCQQxQgRAFVboxEj0hchFl4dO2RXfBEbYase+cWLly5IyfzMo6kKDiHhaYy5gvOhlWz90RmostF6NS9EigNG9xFQU5QdQLDAFBgMrZXAEQHzGGK/setTfXn/tfJ7FyK90ZVanH4sBXGSkRBLt53O+Oj0xViq7MX0OMj0jGa3eJQg5Ej1onY5dN9XJkeuxCwo="]}],"format":"ledger-protokollauszug/1","log_id":"ledger-testprotokoll-1","protocol_keys":null}
