{"chain_days":[{"absent":null,"day":"2026-01-02","present":{"leaf_index":0,"path":["dc78d736670aacefaaf072fd6f9255bea6b72ec977a3169ea07dd75a85c4ac19","aba7e6079b2916f5f57d4a24d5549e8cbc804f2be8db66af7b0c1f4f8733c263","878e8cbe4a32db25bfe05d6d900881150a0338813d917ecc0c7fb8354c90dc9e"],"roots":[{"merkle_root":"c8252a150984a0f7528158fa2bc47e47d5dbde234f0c5f9d01f7443008c87bf8","recorded_as":"countersigned","server_ts":"2026-01-02T23:55:01.000Z","tree_size":5}]}}],"chain_id":"ae2a952f-a992-4ad7-825b-04bc39abb57d","days":[{"additional_signatures":[],"entry":{"server_key_id":"vendor-log-test-001","server_signature":"7f2ce0f16d59dadf31125c4db86399cd38d08b96d37a6d71c662985b8aaac3f1c91ad450756ae35a0d4b32011659fbb5c321d773c34ec6cbe1d0a14e8486790c","statement_jcs":"{\"day\":\"2025-12-31\",\"first_day\":\"2025-12-31\",\"kind\":\"ledger.vendor_log_day.v1\",\"log_id\":\"ledger-testprotokoll-1\",\"prev_hash\":\"0000000000000000000000000000000000000000000000000000000000000000\",\"root\":\"e3b0c44298fc1c149afbf4c8996fb92427ae41e4649b934ca495991b7852b855\",\"server_ts\":\"2026-01-01T00:05:00.000Z\",\"tree_size\":0}"},"timestamps":["MIIDXgYJKoZIhvcNAQcCoIIDTzCCA0sCAQMxDTALBglghkgBZQMEAgMwagYLKoZIhvcNAQkQAQSgWwRZMFcCAQEGDCsGAQQBho0fA4EhAjAvMAsGCWCGSAFlAwQCAQQgM/0bKWbi8Xr1PUeAZsl/HaChge0RB6qjQ0HrS8MGcFUCAiABGA8yMDI2MDEwMTAwMDUwMVqgggFvMIIBazCCAR2gAwIBAgIBAjAFBgMrZXAwSTETMBEGA1UECgwKVGVzdGtvcnB1czEyMDAGA1UEAwwpVGVzdGtvcnB1cyBaZWl0c3RlbXBlbHd1cnplbCAoa2VpbiBaZXVnZSkwHhcNMjUwNjAxMDAwMDAwWhcNMzEwMTAxMDAwMDAwWjBJMRMwEQYDVQQKDApUZXN0a29ycHVzMTIwMAYDVQQDDClUZXN0a29ycHVzIFplaXRzdGVtcGVsc3RlbGxlIChrZWluIFpldWdlKTAqMAUGAytlcAMhAAVGjvI5slNciWer7MP4+J7KJ0O0SxOR46Sd2BBXDfQAoyowKDAOBgNVHQ8BAf8EBAMCB4AwFgYDVR0lAQH/BAwwCgYIKwYBBQUHAwgwBQYDK2VwA0EActwtEkWL7QJ+ML6pNTHxakVjOdps+Nnyqtv9Gt/Q6tqr0MB31axDIMyk6sSsbOpsSrZvbQjyQJdgmv4EYfzpDzGCAVYwggFSAgEBME4wSTETMBEGA1UECgwKVGVzdGtvcnB1czEyMDAGA1UEAwwpVGVzdGtvcnB1cyBaZWl0c3RlbXBlbHd1cnplbCAoa2VpbiBaZXVnZSkCAQIwCwYJYIZIAWUDBAIDoIGmMBoGCSqGSIb3DQEJAzENBgsqhkiG9w0BCRABBDA3BgsqhkiG9w0BCRACLzEoMCYwJDAiBCD3lGg52JlY9bTnaU4oaTPBwZ2Cchin5XQBvg9HoL2jzDBPBgkqhkiG9w0BCQQxQgRASEkuDzmWnj+RSWtHhysaaOGUdXwcbDsVlGEQ6O3sSLF0feYIQiwPjiU+znj/f216ydHWIucFP2XZRU2OQerT/zAFBgMrZXAEQBnAN1m6VVucD3xyYZFvs1BASKWaOpsgoHrsgKeleD+VUQR9H6aITmqVd9Hm0vyZzwP0QwBI3ZXl4uarw5Y5fAw="]},{"additional_signatures":[],"entry":{"server_key_id":"vendor-log-test-001","server_signature":"e8c1045dc0d2857a14778405bf5a92f228c9226bde33aff0abc200f10d884ec1eec116d5d8db6529fbd98fd908e41fa432b40607b62b562b5b644362350ce30a","statement_jcs":"{\"day\":\"2026-01-02\",\"first_day\":\"2025-12-31\",\"kind\":\"ledger.vendor_log_day.v1\",\"log_id\":\"ledger-testprotokoll-1\",\"prev_hash\":\"33fd1b2966e2f17af53d478066c97f1da0a181ed1107aaa34341eb4bc3067055\",\"root\":\"d109c8841771e1df6c43b2d606670086673b15ad18ba2a738fe79de84b21db60\",\"server_ts\":\"2026-01-03T00:05:00.000Z\",\"tree_size\":5}"},"timestamps":["MIIDXgYJKoZIhvcNAQcCoIIDTzCCA0sCAQMxDTALBglghkgBZQMEAgMwagYLKoZIhvcNAQkQAQSgWwRZMFcCAQEGDCsGAQQBho0fA4EhAjAvMAsGCWCGSAFlAwQCAQQg3xIuEv+sghUHhxCQHjWrGP7ImVl/Tj73amKN0uxQWqICAiADGA8yMDI2MDEwMzAwMDUwMVqgggFvMIIBazCCAR2gAwIBAgIBAjAFBgMrZXAwSTETMBEGA1UECgwKVGVzdGtvcnB1czEyMDAGA1UEAwwpVGVzdGtvcnB1cyBaZWl0c3RlbXBlbHd1cnplbCAoa2VpbiBaZXVnZSkwHhcNMjUwNjAxMDAwMDAwWhcNMzEwMTAxMDAwMDAwWjBJMRMwEQYDVQQKDApUZXN0a29ycHVzMTIwMAYDVQQDDClUZXN0a29ycHVzIFplaXRzdGVtcGVsc3RlbGxlIChrZWluIFpldWdlKTAqMAUGAytlcAMhAAVGjvI5slNciWer7MP4+J7KJ0O0SxOR46Sd2BBXDfQAoyowKDAOBgNVHQ8BAf8EBAMCB4AwFgYDVR0lAQH/BAwwCgYIKwYBBQUHAwgwBQYDK2VwA0EActwtEkWL7QJ+ML6pNTHxakVjOdps+Nnyqtv9Gt/Q6tqr0MB31axDIMyk6sSsbOpsSrZvbQjyQJdgmv4EYfzpDzGCAVYwggFSAgEBME4wSTETMBEGA1UECgwKVGVzdGtvcnB1czEyMDAGA1UEAwwpVGVzdGtvcnB1cyBaZWl0c3RlbXBlbHd1cnplbCAoa2VpbiBaZXVnZSkCAQIwCwYJYIZIAWUDBAIDoIGmMBoGCSqGSIb3DQEJAzENBgsqhkiG9w0BCRABBDA3BgsqhkiG9w0BCRACLzEoMCYwJDAiBCD3lGg52JlY9bTnaU4oaTPBwZ2Cchin5XQBvg9HoL2jzDBPBgkqhkiG9w0BCQQxQgRAJrfjJ3yuPvEG20yt82zUIYPDhwNdpkBkMleT0+EXNrVAQiEDX+n0SlQ0A/E9ScP8aAq+nPtp068iw2bs/rRmIzAFBgMrZXAEQDCwl4grBSXSK+z2aToPmAHpjVeAB6RyxlOZMqe+Fi1cZXbkX1twWEHH0rKpXLQu28OB+fvBH8IFzpjlxvJuYw0="]}],"format":"ledger-protokollauszug/1","log_id":"ledger-testprotokoll-1","protocol_keys":{"ausgestellt":"2025-12-30T10:00:00.000Z","erster_tag":"2025-12-31","format":"ledger-protokollschluessel/1","fuellerbindung":"82ba087e5b1b7bee5dbfb6b34620efb2e23e1426ad25fe60a672035fb3a99efe","log_id":"ledger-testprotokoll-1","orte":["https://download.example/ledger-testprotokoll-1","https://mirror.example/ledger-testprotokoll-1"],"schluessel":[{"gueltig_ab":"2025-12-30T00:00:00.000Z","key_id":"vendor-log-test-001","pubkey":"cee49a5a497e248e6be0af06ace16850e8f0eb4c306a212f5430359e8076fdd7"},{"gueltig_ab":"2025-12-30T00:00:00.000Z","key_id":"vendor-log-test-002","pubkey":"8319d7221fdbb1680cb36c8fe33d1507992f14db30ed57c71c46f4ef9313d2a2"}],"signatur":{"sig":"6d0e1d46952e6cf60c640feab00181051fd353a65086dfdff7e7c660feb22650481052690ca0b1f129caed3b4385999d170776d8a89dc94ef859955190aea90a","wurzel_id":"testwurzel-1"},"version":1}}
