{"chain_days":[{"absent":null,"day":"2026-01-02","present":{"leaf_index":3,"path":["2e394a46ea46cc80b472cc0b82929679b4f73f56d70fead1501a5a6c5c273e56","1af55ee78ffd6b957bfab5dd07050fe526fcc351b4a046db001c566b272f9e82","878e8cbe4a32db25bfe05d6d900881150a0338813d917ecc0c7fb8354c90dc9e"],"roots":[{"merkle_root":"8e0a8304a9780ea3738ace50baa309c87cfc25f23777482261cbed15248be77f","recorded_as":"countersigned","server_ts":"2026-01-02T23:55:01.000Z","tree_size":5}]}}],"chain_id":"9234929b-231e-40e2-ae5b-dda55ea5f675","days":[{"additional_signatures":[],"entry":{"server_key_id":"vendor-log-test-001","server_signature":"31ea66813f708b33e4feaf24c84b98025b0af52e881fe6456c9075f3f3e666fa955499dbebdee1212d4d20274aad28a72e8b4558a4c876084c4b792cf67fb203","statement_jcs":"{\"day\":\"2026-01-02\",\"first_day\":\"2025-12-31\",\"kind\":\"ledger.vendor_log_day.v1\",\"log_id\":\"ledger-testprotokoll-1\",\"prev_hash\":\"ef330d2049e93b1da0e934a7a0e01e6b1dc26d392ffdac080ff0ec00889e2c1c\",\"root\":\"42bd54a4d12e43f60dbb34c4abd7f9090c082e6c0d8f25b411014c4c0d088749\",\"server_ts\":\"2026-01-03T00:05:00.000Z\",\"tree_size\":5}"},"timestamps":["MIIDXgYJKoZIhvcNAQcCoIIDTzCCA0sCAQMxDTALBglghkgBZQMEAgMwagYLKoZIhvcNAQkQAQSgWwRZMFcCAQEGDCsGAQQBho0fA4EhAjAvMAsGCWCGSAFlAwQCAQQgpgdWNK61Z/vcoulbgiDCX/dqlhbupLsvfC8ejD+uifQCAiADGA8yMDI2MDEwMzAwMDUwMVqgggFvMIIBazCCAR2gAwIBAgIBAjAFBgMrZXAwSTETMBEGA1UECgwKVGVzdGtvcnB1czEyMDAGA1UEAwwpVGVzdGtvcnB1cyBaZWl0c3RlbXBlbHd1cnplbCAoa2VpbiBaZXVnZSkwHhcNMjUwNjAxMDAwMDAwWhcNMzEwMTAxMDAwMDAwWjBJMRMwEQYDVQQKDApUZXN0a29ycHVzMTIwMAYDVQQDDClUZXN0a29ycHVzIFplaXRzdGVtcGVsc3RlbGxlIChrZWluIFpldWdlKTAqMAUGAytlcAMhAAVGjvI5slNciWer7MP4+J7KJ0O0SxOR46Sd2BBXDfQAoyowKDAOBgNVHQ8BAf8EBAMCB4AwFgYDVR0lAQH/BAwwCgYIKwYBBQUHAwgwBQYDK2VwA0EActwtEkWL7QJ+ML6pNTHxakVjOdps+Nnyqtv9Gt/Q6tqr0MB31axDIMyk6sSsbOpsSrZvbQjyQJdgmv4EYfzpDzGCAVYwggFSAgEBME4wSTETMBEGA1UECgwKVGVzdGtvcnB1czEyMDAGA1UEAwwpVGVzdGtvcnB1cyBaZWl0c3RlbXBlbHd1cnplbCAoa2VpbiBaZXVnZSkCAQIwCwYJYIZIAWUDBAIDoIGmMBoGCSqGSIb3DQEJAzENBgsqhkiG9w0BCRABBDA3BgsqhkiG9w0BCRACLzEoMCYwJDAiBCD3lGg52JlY9bTnaU4oaTPBwZ2Cchin5XQBvg9HoL2jzDBPBgkqhkiG9w0BCQQxQgRAvZwd4URZPn9ryItIY5I3vVFxIj0o/2j4y1c1Z7IEdk8GOa/UkpaeKo8y1zgSL4B7b0I4MxnB5bwCOrfkYta08TAFBgMrZXAEQFWUMM23W8y2cldFn/o/qRA1mY6yhwjuau8jggI30zZEB6tyF0ee1qPaSmUgaGNSjalfHoV6T+Z4V14oAszEsAo="]}],"format":"ledger-protokollauszug/1","log_id":"ledger-testprotokoll-1","protocol_keys":{"ausgestellt":"2025-12-30T10:00:00.000Z","erster_tag":"2025-12-31","format":"ledger-protokollschluessel/1","fuellerbindung":"32af96f223dae9f5ea7e3d48e4f4ef72eb374edfd6b497c6d462d44d18c9739f","log_id":"ledger-testprotokoll-2","orte":["https://download.example/ledger-testprotokoll-1","https://mirror.example/ledger-testprotokoll-1"],"schluessel":[{"gueltig_ab":"2025-12-30T00:00:00.000Z","key_id":"vendor-log-test-001","pubkey":"cee49a5a497e248e6be0af06ace16850e8f0eb4c306a212f5430359e8076fdd7"},{"gueltig_ab":"2025-12-30T00:00:00.000Z","key_id":"vendor-log-test-002","pubkey":"8319d7221fdbb1680cb36c8fe33d1507992f14db30ed57c71c46f4ef9313d2a2"}],"signatur":{"sig":"12478cfbf5caca7b8e27d93b2002aea7e8050a697f07ffe8f97f0f79fdd76b350f5537d288fec70187080c56b3140abd65e2d08f353413593d262f25be558e04","wurzel_id":"testwurzel-1"},"version":1}}
