{"chain_days":[],"chain_id":"784af79b-3a96-4478-a16a-fdfe7ee96992","days":[{"additional_signatures":[],"entry":{"server_key_id":"vendor-log-test-001","server_signature":"01253e9844d87ba9f99b098045d04e9c65de8291fe55faaeb1b08db277926f69c8766f76bae9fb41867a1ebe9e3af42a30780f6c88e54cced43da1849e756804","statement_jcs":"{\"day\":\"2026-01-02\",\"first_day\":\"2025-12-31\",\"kind\":\"ledger.vendor_log_day.v1\",\"log_id\":\"ledger-testprotokoll-1\",\"prev_hash\":\"ef330d2049e93b1da0e934a7a0e01e6b1dc26d392ffdac080ff0ec00889e2c1c\",\"root\":\"0456e0bbd0cae918822a9c83e2232f01358041774a6b319e96b94e1522ac2db2\",\"server_ts\":\"2026-01-03T00:05:00.000Z\",\"tree_size\":5}"},"timestamps":["MIIDhQYJKoZIhvcNAQcCoIIDdjCCA3ICAQMxDTALBglghkgBZQMEAgMwagYLKoZIhvcNAQkQAQSgWwRZMFcCAQEGDCsGAQQBho0fA4EhAjAvMAsGCWCGSAFlAwQCAQQgYFpa4WRnu4rtiGcisD+CBiJ+ajO/UbI4YSN6biu1xq0CAjADGA8yMDI2MDEwMzAwMDUwMVqgggGJMIIBhTCCATegAwIBAgIBAjAFBgMrZXAwVjETMBEGA1UECgwKVGVzdGtvcnB1czE/MD0GA1UEAww2VGVzdGtvcnB1cyBaZWl0c3RlbXBlbHd1cnplbCBFMSAoU2NobHVlc3NlbCB2ZXJ3b3JmZW4pMB4XDTI1MDYwMTAwMDAwMFoXDTMxMDEwMTAwMDAwMFowVjETMBEGA1UECgwKVGVzdGtvcnB1czE/MD0GA1UEAww2VGVzdGtvcnB1cyBaZWl0c3RlbXBlbHN0ZWxsZSBFMSAoU2NobHVlc3NlbCB2ZXJ3b3JmZW4pMCowBQYDK2VwAyEAgfOc/zntWQpH6OsKHuy0y21iRe6ayjwwMO7i/FlB0YCjKjAoMA4GA1UdDwEB/wQEAwIHgDAWBgNVHSUBAf8EDDAKBggrBgEFBQcDCDAFBgMrZXADQQAfb8fMaMOnJfqvEE5R0Lde32UXEgzG8X5fVhwcyRDu74lvFC4Gt9v8taQotMRLPGDR8LV3HJAzYrP3S7Nsvy0LMYIBYzCCAV8CAQEwWzBWMRMwEQYDVQQKDApUZXN0a29ycHVzMT8wPQYDVQQDDDZUZXN0a29ycHVzIFplaXRzdGVtcGVsd3VyemVsIEUxIChTY2hsdWVzc2VsIHZlcndvcmZlbikCAQIwCwYJYIZIAWUDBAIDoIGmMBoGCSqGSIb3DQEJAzENBgsqhkiG9w0BCRABBDA3BgsqhkiG9w0BCRACLzEoMCYwJDAiBCDjviSoHtf5Sh1G6uaDx+f//ZVuDIhJ4UJE1Cw24lm+KTBPBgkqhkiG9w0BCQQxQgRAI0UmKCUts7DqdN2T9mQhZHx3KzikCwL5hw8zBibWRu76ivHFkIanzjWud0GA41uSsjlH9nXslwoNfjY472esDjAFBgMrZXAEQJlzyL1uwciCz3evC19OswCTOSHXB/F/P4vk3saufj9sUAFbS+Pa4xz0dQxqn0flZWUgSp6DuzOP3oTEUXnRMgg="]}],"format":"ledger-protokollauszug/1","log_id":"ledger-testprotokoll-1","protocol_keys":{"ausgestellt":"2025-12-30T10:00:00.000Z","erster_tag":"2025-12-31","format":"ledger-protokollschluessel/1","fuellerbindung":"82ba087e5b1b7bee5dbfb6b34620efb2e23e1426ad25fe60a672035fb3a99efe","log_id":"ledger-testprotokoll-1","orte":["https://download.example/ledger-testprotokoll-1","https://mirror.example/ledger-testprotokoll-1"],"schluessel":[{"gueltig_ab":"2025-12-30T00:00:00.000Z","key_id":"vendor-log-test-001","pubkey":"cee49a5a497e248e6be0af06ace16850e8f0eb4c306a212f5430359e8076fdd7"},{"gueltig_ab":"2025-12-30T00:00:00.000Z","key_id":"vendor-log-test-002","pubkey":"8319d7221fdbb1680cb36c8fe33d1507992f14db30ed57c71c46f4ef9313d2a2"}],"signatur":{"sig":"6d0e1d46952e6cf60c640feab00181051fd353a65086dfdff7e7c660feb22650481052690ca0b1f129caed3b4385999d170776d8a89dc94ef859955190aea90a","wurzel_id":"testwurzel-1"},"version":1}}
