{"chain_days":[{"absent":null,"day":"2026-01-02","present":{"leaf_index":1,"path":["dc78d736670aacefaaf072fd6f9255bea6b72ec977a3169ea07dd75a85c4ac19","aba7e6079b2916f5f57d4a24d5549e8cbc804f2be8db66af7b0c1f4f8733c263","878e8cbe4a32db25bfe05d6d900881150a0338813d917ecc0c7fb8354c90dc9e"],"roots":[{"merkle_root":"20ce1bac59e16ece785996d8d943ef5ee51252007711514b8a1032a9158f57cc","recorded_as":"countersigned","server_ts":"2026-01-02T23:55:01.000Z","tree_size":5}]}}],"chain_id":"80831e3c-acf4-466a-9acd-ce20b54cd9e1","days":[{"additional_signatures":[],"entry":{"server_key_id":"vendor-log-test-001","server_signature":"3ce322f97e76908440d82a8857a6bd741f314b0e1b6bbd80e2c50735c42b3aa3abdf73d090b6eead8ddaf25732f0f23861cddcc507db276e65639f751cf5770c","statement_jcs":"{\"day\":\"2026-01-02\",\"first_day\":\"2025-12-31\",\"kind\":\"ledger.vendor_log_day.v1\",\"log_id\":\"ledger-testprotokoll-1\",\"prev_hash\":\"ef330d2049e93b1da0e934a7a0e01e6b1dc26d392ffdac080ff0ec00889e2c1c\",\"root\":\"ef1cdae3be1c8899f4a17a3da7a9efc11b43106c3e91fd7d36e2556918f0ce74\",\"server_ts\":\"2026-01-03T00:00:20.000Z\",\"tree_size\":5}"},"timestamps":["MIIDigYJKoZIhvcNAQcCoIIDezCCA3cCAQMxDTALBglghkgBZQMEAgMwbwYLKoZIhvcNAQkQAQSgYAReMFwCAQEGDCsGAQQBho0fA4EhAjAvMAsGCWCGSAFlAwQCAQQgGUWMpfknHwCsr8V26HQI4Ou+7P+sNqHm2LwLe5CcgbACAjAHGBQyMDI2MDEwMzAwMDA1OS45OTk5WqCCAYkwggGFMIIBN6ADAgECAgECMAUGAytlcDBWMRMwEQYDVQQKDApUZXN0a29ycHVzMT8wPQYDVQQDDDZUZXN0a29ycHVzIFplaXRzdGVtcGVsd3VyemVsIEUxIChTY2hsdWVzc2VsIHZlcndvcmZlbikwHhcNMjUwNjAxMDAwMDAwWhcNMzEwMTAxMDAwMDAwWjBWMRMwEQYDVQQKDApUZXN0a29ycHVzMT8wPQYDVQQDDDZUZXN0a29ycHVzIFplaXRzdGVtcGVsc3RlbGxlIEUxIChTY2hsdWVzc2VsIHZlcndvcmZlbikwKjAFBgMrZXADIQCB85z/Oe1ZCkfo6woe7LTLbWJF7prKPDAw7uL8WUHRgKMqMCgwDgYDVR0PAQH/BAQDAgeAMBYGA1UdJQEB/wQMMAoGCCsGAQUFBwMIMAUGAytlcANBAB9vx8xow6cl+q8QTlHQt17fZRcSDMbxfl9WHBzJEO7viW8ULga32/y1pCi0xEs8YNHwtXcckDNis/dLs2y/LQsxggFjMIIBXwIBATBbMFYxEzARBgNVBAoMClRlc3Rrb3JwdXMxPzA9BgNVBAMMNlRlc3Rrb3JwdXMgWmVpdHN0ZW1wZWx3dXJ6ZWwgRTEgKFNjaGx1ZXNzZWwgdmVyd29yZmVuKQIBAjALBglghkgBZQMEAgOggaYwGgYJKoZIhvcNAQkDMQ0GCyqGSIb3DQEJEAEEMDcGCyqGSIb3DQEJEAIvMSgwJjAkMCIEIOO+JKge1/lKHUbq5oPH5//9lW4MiEnhQkTULDbiWb4pME8GCSqGSIb3DQEJBDFCBEBzRAs6UIucRzTiiIS2yd3jU/4WnT4G3vRkQiUnnEvhwbOJ6taagsj15L2ruxXy/dQiKjpXudgHvjeKNGwesJUsMAUGAytlcARAnr52h9UOQbovsX2VZ7yVCqNlUxn6zNH6p1sL2Vmx1gPSpWc3kZWmv8z7rmMiRxTx1ZPTfP3JYW0+YqrBqvVyBQ==","MIIDhQYJKoZIhvcNAQcCoIIDdjCCA3ICAQMxDTALBglghkgBZQMEAgMwagYLKoZIhvcNAQkQAQSgWwRZMFcCAQEGDCsGAQQBho0fA4EhAjAvMAsGCWCGSAFlAwQCAQQgGUWMpfknHwCsr8V26HQI4Ou+7P+sNqHm2LwLe5CcgbACAjAIGA8yMDI2MDEwMzAwMDUwMVqgggGJMIIBhTCCATegAwIBAgIBAjAFBgMrZXAwVjETMBEGA1UECgwKVGVzdGtvcnB1czE/MD0GA1UEAww2VGVzdGtvcnB1cyBaZWl0c3RlbXBlbHd1cnplbCBFMSAoU2NobHVlc3NlbCB2ZXJ3b3JmZW4pMB4XDTI1MDYwMTAwMDAwMFoXDTMxMDEwMTAwMDAwMFowVjETMBEGA1UECgwKVGVzdGtvcnB1czE/MD0GA1UEAww2VGVzdGtvcnB1cyBaZWl0c3RlbXBlbHN0ZWxsZSBFMSAoU2NobHVlc3NlbCB2ZXJ3b3JmZW4pMCowBQYDK2VwAyEAgfOc/zntWQpH6OsKHuy0y21iRe6ayjwwMO7i/FlB0YCjKjAoMA4GA1UdDwEB/wQEAwIHgDAWBgNVHSUBAf8EDDAKBggrBgEFBQcDCDAFBgMrZXADQQAfb8fMaMOnJfqvEE5R0Lde32UXEgzG8X5fVhwcyRDu74lvFC4Gt9v8taQotMRLPGDR8LV3HJAzYrP3S7Nsvy0LMYIBYzCCAV8CAQEwWzBWMRMwEQYDVQQKDApUZXN0a29ycHVzMT8wPQYDVQQDDDZUZXN0a29ycHVzIFplaXRzdGVtcGVsd3VyemVsIEUxIChTY2hsdWVzc2VsIHZlcndvcmZlbikCAQIwCwYJYIZIAWUDBAIDoIGmMBoGCSqGSIb3DQEJAzENBgsqhkiG9w0BCRABBDA3BgsqhkiG9w0BCRACLzEoMCYwJDAiBCDjviSoHtf5Sh1G6uaDx+f//ZVuDIhJ4UJE1Cw24lm+KTBPBgkqhkiG9w0BCQQxQgRAR1F8P44AhfV1ByvnOctHWDu7i2TjCGfI8AqII8W32g8kyiVd6XeTXXjLbJ3qCLjAaEtsPrLUHsjqA/drJO9xCjAFBgMrZXAEQIb6ZCiJ+n1Ijz/L4EVLaSfMuX+VZvZvE+/zOabI9w++OiyAYrbee6sJPyKQPso1KfzaS2e6sK30gvM76LSPdA4="]}],"format":"ledger-protokollauszug/1","log_id":"ledger-testprotokoll-1","protocol_keys":{"ausgestellt":"2025-12-30T10:00:00.000Z","erster_tag":"2025-12-31","format":"ledger-protokollschluessel/1","fuellerbindung":"82ba087e5b1b7bee5dbfb6b34620efb2e23e1426ad25fe60a672035fb3a99efe","log_id":"ledger-testprotokoll-1","orte":["https://download.example/ledger-testprotokoll-1","https://mirror.example/ledger-testprotokoll-1"],"schluessel":[{"gueltig_ab":"2025-12-30T00:00:00.000Z","key_id":"vendor-log-test-001","pubkey":"cee49a5a497e248e6be0af06ace16850e8f0eb4c306a212f5430359e8076fdd7"},{"gueltig_ab":"2025-12-30T00:00:00.000Z","key_id":"vendor-log-test-002","pubkey":"8319d7221fdbb1680cb36c8fe33d1507992f14db30ed57c71c46f4ef9313d2a2"}],"signatur":{"sig":"6d0e1d46952e6cf60c640feab00181051fd353a65086dfdff7e7c660feb22650481052690ca0b1f129caed3b4385999d170776d8a89dc94ef859955190aea90a","wurzel_id":"testwurzel-1"},"version":1}}
