{"chain_days":[{"absent":null,"day":"2026-01-02","present":{"leaf_index":382,"path":["a5a34b01b52d478ae14891ac940f95ba9a402a1918833fac193c751791f9a5cd","4f3e771638e4b6f701880cf76b5aa9ab15967e1ab1fc6af52ee34cfda7e5f954","136323f49a911873758828026a429e2f21a6c0f22fa9dcbde511765f92cf76c7","2df1d06c2bd04f154d9806c48237cd21fb8bd2771c08ff4e9094d8bed0395de6","2322657c885c22ad93855b814a123e677d9558571f84308dc034a1a4d9b85728","c8de6c0f5ef1d72c6d231cd48713a29e03862d0f99d09a4f7beefe6aa7affbff","1abc5de522c303e1f15b818978509bd0054a98acf0f961848f6aedac163b7efe","453ef75b0c310d561c8cac04a4211514c12a0b958183130835160ce6d46c997d","3d684f285cea98e64d563d3078b8f390bc13d53718d7f08af96967ebfd0ca590","1b326f4cc45dc208f301797949fdc7560c6d6a5927eebdc5b1e938b1f5d90496"],"roots":[{"merkle_root":"c2c3f9dd280e32adb250f910beadc1a8e41ccbfbb1f64038821897a352dd930b","recorded_as":"countersigned","server_ts":"2026-01-02T23:55:01.000Z","tree_size":5}]}}],"chain_id":"a04898df-eaa5-4e49-b620-82c09c9bfe9b","days":[{"additional_signatures":[],"entry":{"server_key_id":"vendor-log-test-001","server_signature":"899906ae80c5ff73f872a4ae01f1ec1d377e7b0971b97a04ba98feeef673f7b008fc34b8f1ec9fa9712a4f418f52f479b0ca8f93a7c9080ac51c595fd7ad970c","statement_jcs":"{\"day\":\"2026-01-02\",\"first_day\":\"2025-12-31\",\"kind\":\"ledger.vendor_log_day.v1\",\"log_id\":\"ledger-testprotokoll-1\",\"prev_hash\":\"ef330d2049e93b1da0e934a7a0e01e6b1dc26d392ffdac080ff0ec00889e2c1c\",\"root\":\"e60c56d1bb828570da7199baaa496b8af0bd485a0bd07c28a75ca564d4b4fe59\",\"server_ts\":\"2026-01-03T00:05:00.000Z\",\"tree_size\":1024}"},"timestamps":["MIIDXgYJKoZIhvcNAQcCoIIDTzCCA0sCAQMxDTALBglghkgBZQMEAgMwagYLKoZIhvcNAQkQAQSgWwRZMFcCAQEGDCsGAQQBho0fA4EhAjAvMAsGCWCGSAFlAwQCAQQgoGDez2ZUdem02rm6MCpf63p4SKBeUlMzP6FnpmKjBcYCAiADGA8yMDI2MDEwMzAwMDUwMVqgggFvMIIBazCCAR2gAwIBAgIBAjAFBgMrZXAwSTETMBEGA1UECgwKVGVzdGtvcnB1czEyMDAGA1UEAwwpVGVzdGtvcnB1cyBaZWl0c3RlbXBlbHd1cnplbCAoa2VpbiBaZXVnZSkwHhcNMjUwNjAxMDAwMDAwWhcNMzEwMTAxMDAwMDAwWjBJMRMwEQYDVQQKDApUZXN0a29ycHVzMTIwMAYDVQQDDClUZXN0a29ycHVzIFplaXRzdGVtcGVsc3RlbGxlIChrZWluIFpldWdlKTAqMAUGAytlcAMhAAVGjvI5slNciWer7MP4+J7KJ0O0SxOR46Sd2BBXDfQAoyowKDAOBgNVHQ8BAf8EBAMCB4AwFgYDVR0lAQH/BAwwCgYIKwYBBQUHAwgwBQYDK2VwA0EActwtEkWL7QJ+ML6pNTHxakVjOdps+Nnyqtv9Gt/Q6tqr0MB31axDIMyk6sSsbOpsSrZvbQjyQJdgmv4EYfzpDzGCAVYwggFSAgEBME4wSTETMBEGA1UECgwKVGVzdGtvcnB1czEyMDAGA1UEAwwpVGVzdGtvcnB1cyBaZWl0c3RlbXBlbHd1cnplbCAoa2VpbiBaZXVnZSkCAQIwCwYJYIZIAWUDBAIDoIGmMBoGCSqGSIb3DQEJAzENBgsqhkiG9w0BCRABBDA3BgsqhkiG9w0BCRACLzEoMCYwJDAiBCD3lGg52JlY9bTnaU4oaTPBwZ2Cchin5XQBvg9HoL2jzDBPBgkqhkiG9w0BCQQxQgRAn6dSh2qUMomjDnLL++JLiQL8p5mEF/5jK0A5ftdlwqJ3dGK7mMauEn358t+sZdSS44BBvKxY83DSEsBfyDiG7jAFBgMrZXAEQHv5mNsA7pqcnBH5AHjLiYFMLduldlSp3RXOos3T3XoITPaC0iE3K8Szz5t+cV8gU78FB+bv1h82CnMAp8WEnwo="]}],"format":"ledger-protokollauszug/1","log_id":"ledger-testprotokoll-1","protocol_keys":{"ausgestellt":"2025-12-30T10:00:00.000Z","erster_tag":"2025-12-31","format":"ledger-protokollschluessel/1","fuellerbindung":"82ba087e5b1b7bee5dbfb6b34620efb2e23e1426ad25fe60a672035fb3a99efe","log_id":"ledger-testprotokoll-1","orte":["https://download.example/ledger-testprotokoll-1","https://mirror.example/ledger-testprotokoll-1"],"schluessel":[{"gueltig_ab":"2025-12-30T00:00:00.000Z","key_id":"vendor-log-test-001","pubkey":"cee49a5a497e248e6be0af06ace16850e8f0eb4c306a212f5430359e8076fdd7"},{"gueltig_ab":"2025-12-30T00:00:00.000Z","key_id":"vendor-log-test-002","pubkey":"8319d7221fdbb1680cb36c8fe33d1507992f14db30ed57c71c46f4ef9313d2a2"}],"signatur":{"sig":"6d0e1d46952e6cf60c640feab00181051fd353a65086dfdff7e7c660feb22650481052690ca0b1f129caed3b4385999d170776d8a89dc94ef859955190aea90a","wurzel_id":"testwurzel-1"},"version":1}}
