{"chain_days":[{"absent":null,"day":"2026-01-02","present":{"leaf_index":1,"path":["dc78d736670aacefaaf072fd6f9255bea6b72ec977a3169ea07dd75a85c4ac19","aba7e6079b2916f5f57d4a24d5549e8cbc804f2be8db66af7b0c1f4f8733c263","878e8cbe4a32db25bfe05d6d900881150a0338813d917ecc0c7fb8354c90dc9e"],"roots":[{"merkle_root":"d3d9640dd6cc4a14096429e7943dabcc02dfa9e2e1e05796a6cd3cd3c0d3f62c","recorded_as":"countersigned","server_ts":"2026-01-02T23:55:01.000Z","tree_size":6}]}}],"chain_id":"6bc704e8-0569-4a19-9351-0745c66bd20d","days":[{"additional_signatures":[],"entry":{"server_key_id":"vendor-log-test-001","server_signature":"8f5d27e579fe7b52b34197ce804f147d569286798bdaf73ae648a90cd21053291b9bad833c92dc5198a9c77c7a308f962a3fc7e5b72db1ac5ac81e8b980d5d07","statement_jcs":"{\"day\":\"2026-01-02\",\"first_day\":\"2025-12-31\",\"kind\":\"ledger.vendor_log_day.v1\",\"log_id\":\"ledger-testprotokoll-1\",\"prev_hash\":\"ef330d2049e93b1da0e934a7a0e01e6b1dc26d392ffdac080ff0ec00889e2c1c\",\"root\":\"de2a7a2b0e6874bcfa21b59e7d9c1a3e0d6e0c6805084500630b3e1425583626\",\"server_ts\":\"2026-01-03T00:05:00.000Z\",\"tree_size\":5}"},"timestamps":["MIIDsAYJKoZIhvcNAQcCoIIDoTCCA50CAQMxDTALBglghkgBZQMEAgMwgYcGCyqGSIb3DQEJEAEEoHgEdjB0AgEBBgwrBgEEAYaNHwOBIQIwLzALBglghkgBZQMEAgEEIG1LUNa2v/QTMOUtrn8URHbjTv+i24Evh5RMUgZTgGGzAgJQAhgPMjAyNjAxMDMwMDA1MDFaoRswGQYIKwYBBQUHAQMEDTALMAkGBwQAgZdeAQGgggGWMIIBkjCCAUSgAwIBAgIBAzAFBgMrZXAwVjETMBEGA1UECgwKVGVzdGtvcnB1czE/MD0GA1UEAww2VGVzdGtvcnB1cyBaZWl0c3RlbXBlbHd1cnplbCBFMyAoU2NobHVlc3NlbCB2ZXJ3b3JmZW4pMB4XDTI1MDYwMTAwMDAwMFoXDTMxMDEwMTAwMDAwMFowYzETMBEGA1UECgwKVGVzdGtvcnB1czFMMEoGA1UEAwxDVGVzdGtvcnB1cyBaZWl0c3RlbXBlbHN0ZWxsZSBFMyBxY1N0YXRlbWVudHMgKFNjaGx1ZXNzZWwgdmVyd29yZmVuKTAqMAUGAytlcAMhAE1J6AfNdBo5JCcyPBzEC38xl4ZMg/Q+nMTDf99qGQvfoyowKDAOBgNVHQ8BAf8EBAMCB4AwFgYDVR0lAQH/BAwwCgYIKwYBBQUHAwgwBQYDK2VwA0EAtiS2gXwbPYvF0d64gZgKAfZI+FmLJYIdjcmQYgRfnMbpBslkAtQPuAD/5gBH6aa+bnqu9Hfj7DFACoene6fLDjGCAWMwggFfAgEBMFswVjETMBEGA1UECgwKVGVzdGtvcnB1czE/MD0GA1UEAww2VGVzdGtvcnB1cyBaZWl0c3RlbXBlbHd1cnplbCBFMyAoU2NobHVlc3NlbCB2ZXJ3b3JmZW4pAgEDMAsGCWCGSAFlAwQCA6CBpjAaBgkqhkiG9w0BCQMxDQYLKoZIhvcNAQkQAQQwNwYLKoZIhvcNAQkQAi8xKDAmMCQwIgQgGulgn2ijP1gP7lTRNuZf1hGchd7X/KRLRdszAfPaxFEwTwYJKoZIhvcNAQkEMUIEQACuqvg3wIPRrYUyDITUnO/46zThVIGX78dkwSRiTJy8IWn6PamM5NGItcQZWH3O8DWa5zM1SYYtVXIdmd9nOzMwBQYDK2VwBEBnMsKTA5zaKucSF6oEHG1tqBVoySaXLmGm9Zl6am4MNPLjxlntrgbS6DLct7NY9XmXP5W2xukDbqFm0N1/CzQP"]}],"format":"ledger-protokollauszug/1","log_id":"ledger-testprotokoll-1","protocol_keys":{"ausgestellt":"2025-12-30T10:00:00.000Z","erster_tag":"2025-12-31","format":"ledger-protokollschluessel/1","fuellerbindung":"82ba087e5b1b7bee5dbfb6b34620efb2e23e1426ad25fe60a672035fb3a99efe","log_id":"ledger-testprotokoll-1","orte":["https://download.example/ledger-testprotokoll-1","https://mirror.example/ledger-testprotokoll-1"],"schluessel":[{"gueltig_ab":"2025-12-30T00:00:00.000Z","key_id":"vendor-log-test-001","pubkey":"cee49a5a497e248e6be0af06ace16850e8f0eb4c306a212f5430359e8076fdd7"},{"gueltig_ab":"2025-12-30T00:00:00.000Z","key_id":"vendor-log-test-002","pubkey":"8319d7221fdbb1680cb36c8fe33d1507992f14db30ed57c71c46f4ef9313d2a2"}],"signatur":{"sig":"6d0e1d46952e6cf60c640feab00181051fd353a65086dfdff7e7c660feb22650481052690ca0b1f129caed3b4385999d170776d8a89dc94ef859955190aea90a","wurzel_id":"testwurzel-1"},"version":1}}
