{"chain_days":[{"absent":null,"day":"2026-01-02","present":{"leaf_index":2,"path":["2e394a46ea46cc80b472cc0b82929679b4f73f56d70fead1501a5a6c5c273e56","1af55ee78ffd6b957bfab5dd07050fe526fcc351b4a046db001c566b272f9e82","878e8cbe4a32db25bfe05d6d900881150a0338813d917ecc0c7fb8354c90dc9e"],"roots":[{"merkle_root":"93cbcb7c183b4c4a7f4087540537b6c959a1a4af7e63bb7482070b5f80258add","recorded_as":"countersigned","server_ts":"2026-01-02T23:55:01.000Z","tree_size":5}]}}],"chain_id":"8863152a-49e7-40b5-b76b-e75c860abf26","days":[{"additional_signatures":[{"alg":"ecdsa-p256-sha256","key_id":"vendor-log-test-002","signature":"9816f282df26865dcdb603e0bc005a8a3b524b527e85be0bd501d820a7d7dd32ffec4ebec502d76dbd7f0899d81ee38fb245d4ad3c4879f5c1a579243f7890a2"},{"alg":"ecdsa-p256-sha256","key_id":"vendor-log-test-002","signature":"9816f282df26865dcdb603e0bc005a8a3b524b527e85be0bd501d820a7d7dd32ffec4ebec502d76dbd7f0899d81ee38fb245d4ad3c4879f5c1a579243f7890a2"}],"entry":{"server_key_id":"vendor-log-test-001","server_signature":"2027469703e8dfd2ed0d3ad57cdc7d0f799b3001348242fab531907f30ccb75850543575228d12ed3c83fafe4bfdf245dd45153ac646b8fd5ef48da94bca1304","statement_jcs":"{\"day\":\"2026-01-02\",\"first_day\":\"2025-12-31\",\"kind\":\"ledger.vendor_log_day.v1\",\"log_id\":\"ledger-testprotokoll-1\",\"prev_hash\":\"ef330d2049e93b1da0e934a7a0e01e6b1dc26d392ffdac080ff0ec00889e2c1c\",\"root\":\"4b8116afebc7787918dacc6c86e225c66213545b2473eee5bf270c7b2cd8b580\",\"server_ts\":\"2026-01-03T00:05:00.000Z\",\"tree_size\":5}"},"timestamps":["MIIDXgYJKoZIhvcNAQcCoIIDTzCCA0sCAQMxDTALBglghkgBZQMEAgMwagYLKoZIhvcNAQkQAQSgWwRZMFcCAQEGDCsGAQQBho0fA4EhAjAvMAsGCWCGSAFlAwQCAQQgi9yPaMrBcgAH3d7nkJ8PrC5pdnTRJLuo7Eg1GdKO8wcCAiADGA8yMDI2MDEwMzAwMDUwMVqgggFvMIIBazCCAR2gAwIBAgIBAjAFBgMrZXAwSTETMBEGA1UECgwKVGVzdGtvcnB1czEyMDAGA1UEAwwpVGVzdGtvcnB1cyBaZWl0c3RlbXBlbHd1cnplbCAoa2VpbiBaZXVnZSkwHhcNMjUwNjAxMDAwMDAwWhcNMzEwMTAxMDAwMDAwWjBJMRMwEQYDVQQKDApUZXN0a29ycHVzMTIwMAYDVQQDDClUZXN0a29ycHVzIFplaXRzdGVtcGVsc3RlbGxlIChrZWluIFpldWdlKTAqMAUGAytlcAMhAAVGjvI5slNciWer7MP4+J7KJ0O0SxOR46Sd2BBXDfQAoyowKDAOBgNVHQ8BAf8EBAMCB4AwFgYDVR0lAQH/BAwwCgYIKwYBBQUHAwgwBQYDK2VwA0EActwtEkWL7QJ+ML6pNTHxakVjOdps+Nnyqtv9Gt/Q6tqr0MB31axDIMyk6sSsbOpsSrZvbQjyQJdgmv4EYfzpDzGCAVYwggFSAgEBME4wSTETMBEGA1UECgwKVGVzdGtvcnB1czEyMDAGA1UEAwwpVGVzdGtvcnB1cyBaZWl0c3RlbXBlbHd1cnplbCAoa2VpbiBaZXVnZSkCAQIwCwYJYIZIAWUDBAIDoIGmMBoGCSqGSIb3DQEJAzENBgsqhkiG9w0BCRABBDA3BgsqhkiG9w0BCRACLzEoMCYwJDAiBCD3lGg52JlY9bTnaU4oaTPBwZ2Cchin5XQBvg9HoL2jzDBPBgkqhkiG9w0BCQQxQgRAQHCtxbf8P/wH1VzIN4mUixl2KRTgAjwkL6ydiR2gg15tOvJPhMFZIlJw4z6M4d9DMSvFNnYKC5ES6jC49fq1ezAFBgMrZXAEQF/A7ZaOpDqCZ87IoewUTsYwbMFWuzS+7a0aqsJdaRJHJcJKj47pzcy9nJ2y1qy2MQ93ddA7e2nHd2+lEDFtgg4="]}],"format":"ledger-protokollauszug/1","log_id":"ledger-testprotokoll-1","protocol_keys":{"ausgestellt":"2025-12-30T10:00:00.000Z","erster_tag":"2025-12-31","format":"ledger-protokollschluessel/1","fuellerbindung":"82ba087e5b1b7bee5dbfb6b34620efb2e23e1426ad25fe60a672035fb3a99efe","log_id":"ledger-testprotokoll-1","orte":["https://download.example/ledger-testprotokoll-1","https://mirror.example/ledger-testprotokoll-1"],"schluessel":[{"gueltig_ab":"2025-12-30T00:00:00.000Z","key_id":"vendor-log-test-001","pubkey":"cee49a5a497e248e6be0af06ace16850e8f0eb4c306a212f5430359e8076fdd7"},{"gueltig_ab":"2025-12-30T00:00:00.000Z","key_id":"vendor-log-test-002","pubkey":"8319d7221fdbb1680cb36c8fe33d1507992f14db30ed57c71c46f4ef9313d2a2"}],"signatur":{"sig":"6d0e1d46952e6cf60c640feab00181051fd353a65086dfdff7e7c660feb22650481052690ca0b1f129caed3b4385999d170776d8a89dc94ef859955190aea90a","wurzel_id":"testwurzel-1"},"version":1}}
