{"chain_days":[{"absent":null,"day":"2026-01-02","present":{"leaf_index":1,"path":["dc78d736670aacefaaf072fd6f9255bea6b72ec977a3169ea07dd75a85c4ac19","aba7e6079b2916f5f57d4a24d5549e8cbc804f2be8db66af7b0c1f4f8733c263","878e8cbe4a32db25bfe05d6d900881150a0338813d917ecc0c7fb8354c90dc9e"],"roots":[{"merkle_root":"27ab014dbffa49f3524a85fa817656e8503d1ae735ff094454a9f62f6bca8696","recorded_as":"countersigned","server_ts":"2026-01-02T23:55:01.000Z","tree_size":5}]}}],"chain_id":"34b6c43a-17a0-47ca-9f52-6d0b535f1252","days":[{"additional_signatures":[],"entry":{"server_key_id":"vendor-log-test-001","server_signature":"96105351ddb320735a7a45b1cfd76b07226bafa1aedbd512b0cde115e592036aa9da8479cd33869bb60f40d3d326aaa72ab424b0b9fc1c43e0be6fb1d4c8f901","statement_jcs":"{\"day\":\"2026-01-02\",\"first_day\":\"2025-12-31\",\"kind\":\"ledger.vendor_log_day.v1\",\"log_id\":\"ledger-testprotokoll-1\",\"prev_hash\":\"ef330d2049e93b1da0e934a7a0e01e6b1dc26d392ffdac080ff0ec00889e2c1c\",\"root\":\"11a7e12ecfa7401d385465ed7f9d2a8edbe61579182a457fed165c2815ba5ac2\",\"server_ts\":\"2026-01-03T00:05:00.000Z\",\"tree_size\":5}"},"timestamps":["MIIDhQYJKoZIhvcNAQcCoIIDdjCCA3ICAQMxDTALBglghkgBZQMEAgMwagYLKoZIhvcNAQkQAQSgWwRZMFcCAQEGDCsGAQQBho0fA4EhAjAvMAsGCWCGSAFlAwQCAQQgwVtbsr75JraPOelLGSFO0qf3n087o4W3pWUp8jpeX3sCAjABGA8yMDI2MDEwMzAwMDUwMVqgggGJMIIBhTCCATegAwIBAgIBAjAFBgMrZXAwVjETMBEGA1UECgwKVGVzdGtvcnB1czE/MD0GA1UEAww2VGVzdGtvcnB1cyBaZWl0c3RlbXBlbHd1cnplbCBFMSAoU2NobHVlc3NlbCB2ZXJ3b3JmZW4pMB4XDTI1MDYwMTAwMDAwMFoXDTMxMDEwMTAwMDAwMFowVjETMBEGA1UECgwKVGVzdGtvcnB1czE/MD0GA1UEAww2VGVzdGtvcnB1cyBaZWl0c3RlbXBlbHN0ZWxsZSBFMSAoU2NobHVlc3NlbCB2ZXJ3b3JmZW4pMCowBQYDK2VwAyEAgfOc/zntWQpH6OsKHuy0y21iRe6ayjwwMO7i/FlB0YCjKjAoMA4GA1UdDwEB/wQEAwIHgDAWBgNVHSUBAf8EDDAKBggrBgEFBQcDCDAFBgMrZXADQQAfb8fMaMOnJfqvEE5R0Lde32UXEgzG8X5fVhwcyRDu74lvFC4Gt9v8taQotMRLPGDR8LV3HJAzYrP3S7Nsvy0LMYIBYzCCAV8CAQEwWzBWMRMwEQYDVQQKDApUZXN0a29ycHVzMT8wPQYDVQQDDDZUZXN0a29ycHVzIFplaXRzdGVtcGVsd3VyemVsIEUxIChTY2hsdWVzc2VsIHZlcndvcmZlbikCAQIwCwYJYIZIAWUDBAIDoIGmMBoGCSqGSIb3DQEJAzENBgsqhkiG9w0BCRABBDA3BgsqhkiG9w0BCRACLzEoMCYwJDAiBCDjviSoHtf5Sh1G6uaDx+f//ZVuDIhJ4UJE1Cw24lm+KTBPBgkqhkiG9w0BCQQxQgRAgAL3jcO+o+TgnuQo9VTWsppTnywUP/fe6Pn0J6xqJ6aIeOTLD1+1dLwMoIIimintg+fyJcJTSfrstgiKX9v78jAFBgMrZXAEQGRYMsu5EoXFX7eZn8eg7O0yj+SShmwGT8Xhayw5W6NQ3RUkzxxIUIPwVY3BkU7voaQ1ki+wruXBvqZrEENs2gY=","MIIDXgYJKoZIhvcNAQcCoIIDTzCCA0sCAQMxDTALBglghkgBZQMEAgMwagYLKoZIhvcNAQkQAQSgWwRZMFcCAQEGDCsGAQQBho0fA4EhAjAvMAsGCWCGSAFlAwQCAQQgwVtbsr75JraPOelLGSFO0qf3n087o4W3pWUp8jpeX3sCAiEBGA8yMDI2MDEwMzAwMDUwMlqgggFvMIIBazCCAR2gAwIBAgIBAjAFBgMrZXAwSTETMBEGA1UECgwKVGVzdGtvcnB1czEyMDAGA1UEAwwpVGVzdGtvcnB1cyBaZWl0c3RlbXBlbHd1cnplbCAoa2VpbiBaZXVnZSkwHhcNMjUwNjAxMDAwMDAwWhcNMzEwMTAxMDAwMDAwWjBJMRMwEQYDVQQKDApUZXN0a29ycHVzMTIwMAYDVQQDDClUZXN0a29ycHVzIFplaXRzdGVtcGVsc3RlbGxlIChrZWluIFpldWdlKTAqMAUGAytlcAMhAAVGjvI5slNciWer7MP4+J7KJ0O0SxOR46Sd2BBXDfQAoyowKDAOBgNVHQ8BAf8EBAMCB4AwFgYDVR0lAQH/BAwwCgYIKwYBBQUHAwgwBQYDK2VwA0EActwtEkWL7QJ+ML6pNTHxakVjOdps+Nnyqtv9Gt/Q6tqr0MB31axDIMyk6sSsbOpsSrZvbQjyQJdgmv4EYfzpDzGCAVYwggFSAgEBME4wSTETMBEGA1UECgwKVGVzdGtvcnB1czEyMDAGA1UEAwwpVGVzdGtvcnB1cyBaZWl0c3RlbXBlbHd1cnplbCAoa2VpbiBaZXVnZSkCAQIwCwYJYIZIAWUDBAIDoIGmMBoGCSqGSIb3DQEJAzENBgsqhkiG9w0BCRABBDA3BgsqhkiG9w0BCRACLzEoMCYwJDAiBCD3lGg52JlY9bTnaU4oaTPBwZ2Cchin5XQBvg9HoL2jzDBPBgkqhkiG9w0BCQQxQgRAzPNVODgGLjcDyqFfLL1hG0Mw6QIC+ZTengHwQm3Fg8cIRHUbDuoe8QHFg2uEZE+9zC+ku9igM8ncxu09BC8rKTAFBgMrZXAEQPNrVE1dw6eAM40P6tjbEiYe+06tIPUhYRxOIjN1mkdE+W7P461XLvpgyka1jmKuWamgdlciMNr3E1eyD+L1VAg="]}],"format":"ledger-protokollauszug/1","log_id":"ledger-testprotokoll-1","protocol_keys":{"ausgestellt":"2025-12-30T10:00:00.000Z","erster_tag":"2025-12-31","format":"ledger-protokollschluessel/1","fuellerbindung":"82ba087e5b1b7bee5dbfb6b34620efb2e23e1426ad25fe60a672035fb3a99efe","log_id":"ledger-testprotokoll-1","orte":["https://download.example/ledger-testprotokoll-1","https://mirror.example/ledger-testprotokoll-1"],"schluessel":[{"gueltig_ab":"2025-12-30T00:00:00.000Z","key_id":"vendor-log-test-001","pubkey":"cee49a5a497e248e6be0af06ace16850e8f0eb4c306a212f5430359e8076fdd7"},{"gueltig_ab":"2025-12-30T00:00:00.000Z","key_id":"vendor-log-test-002","pubkey":"8319d7221fdbb1680cb36c8fe33d1507992f14db30ed57c71c46f4ef9313d2a2"}],"signatur":{"sig":"6d0e1d46952e6cf60c640feab00181051fd353a65086dfdff7e7c660feb22650481052690ca0b1f129caed3b4385999d170776d8a89dc94ef859955190aea90a","wurzel_id":"testwurzel-1"},"version":1}}
